<?xml version="1.0" encoding="UTF-8"?>
<MediaOrder xmlns:xsi="http://www.w3.org/2001/XMLSchema-instance" xsi:noNamespaceSchemaLocation="mediaOrderSchema.xsd">
  <OrderId>PO200901</OrderId>
  <Items>
    <Item>
      <ItemId>200001</ItemId>
      <ProductId>B006</ProductId>
      <Amount>7</Amount>
      <Price>7.45</Price>
    </Item>
    <Item>
      <ItemId>200002</ItemId>
      <ProductId>B005</ProductId>
      <Amount>1</Amount>
      <Price>67.99</Price>
    </Item>
    <Item>
      <ItemId>200003</ItemId>
      <ProductId>B007</ProductId>
      <Amount>0</Amount>
      <Price>0</Price>
    </Item>
    <Item>
      <ItemId>200004</ItemId>
      <ProductId>B005</ProductId>
      <Amount>2</Amount>
      <Price>63.99</Price>
    </Item>
  </Items>
  <Books>
    <Book>
      <BookId>B005</BookId>
      <Author>Heinlein</Author>
      <Review>
        <Reviewid>1</Reviewid>
        <Comment>best Book ever</Comment>
      </Review>
      <Review>
        <Reviewid>2</Reviewid>
        <Comment>would recommend</Comment>
      </Review>
    </Book>
    <Book>
      <BookId>B006</BookId>
      <Author>Isaac Asimov</Author>
    </Book>
    <Book>
      <BookId>B008</BookId>
      <Author>Ian M Banks</Author>
    </Book>
  </Books>
</MediaOrder>
