<?xml version="1.0" encoding="UTF-8"?>
<MediaOrder xmlns:xsi="http://www.w3.org/2001/XMLSchema-instance" xsi:noNamespaceSchemaLocation="mediaOrderSchema.xsd">
  <OrderId>PO200901</OrderId>
  <Items>
    <Item>
      <ItemId>100001</ItemId>
      <ProductId>B001</ProductId>
      <Amount>10</Amount>
      <Price>11.95</Price>
    </Item>
  </Items>
  <Books>
    <Book>
      <BookId>B001</BookId>
      <Author>Orson Scott Card</Author>
      <Review>
        <ReviewId>1</ReviewId>
        <Comment>best Book ever</Comment>
      </Review>
    </Book>
    <Book>
      <BookId>B002</BookId>
      <Author>Isaac Asimov</Author>
    </Book>
  </Books>
</MediaOrder>
